title,url,date,summary,datetime
വീണാ വിജയൻ അടക്കമുള്ളവരുടെ മൊഴിയെടുക്കണം; ഇഡി കോടതിയിൽ അപേക്ഷ നൽകി,https://keralakaumudi.com/news/news.php?id=1520572&u=cmrl-case-veena-vijayan-statement,2025-04-21,തിരുവനന്തപുരം: സി എം ആർ എൽ - എക്‌സാലോജിക് ഇടപാട് കേസിൽ  മുഖ്യമന്ത്രി പിണറായി വിജയന്റെ മകൾ വീണാ വിജയൻ അടക്കമുള്ളവരുടെ മൊഴിയെടുക്കുന്നതിൽ അനുമതി തേടി ഇ ഡി.,2025-04-21
"'ഒറ്റയ്‌ക്ക് വന്നാൽ ഒപ്പം കൂട്ടാം, തൃണമൂലിനൊപ്പം വേണ്ട'; അൻവറുമായി ചർച്ചയ്‌ക്കൊരുങ്ങി കോൺഗ്രസ്",https://keralakaumudi.com/news/news.php?id=1520563&u=congress-tmc-rift,2025-04-21,തിരുവനന്തപുരം: തൃണമൂൽ കോൺഗ്രസിനെ മുന്നണിയുടെ ഭാഗമാക്കാതെ പിവി അൻവറിനെ യുഡിഎഫിലെടുക്കാമെന്ന് തീരുമാനിച്ച് കോൺഗ്രസ്.,2025-04-21
പോക്‌സോ കേസ് അതിജീവിതയായ പതിനേഴുകാരിയേയും മൂന്ന് വയസുള്ള കുഞ്ഞിനെയും കാണാതായി,https://keralakaumudi.com/news/news.php?id=1520566&u=pocso-case-victim-and-child-missing,2025-04-21,കോഴിക്കോട്: പ്രായപൂർത്തിയാകാത്ത പെൺകുട്ടിയേയും കുഞ്ഞിനെയും കോഴിക്കോട്ടെ വനിതാ ശിശു സംരക്ഷണ കേന്ദ്രത്തിൽ നിന്ന് കാണാതായി.,2025-04-21
'സെറ്റുകളിൽ ലഹരി എത്തിക്കാൻ ഇടനിലക്കാർ'; ഷെെനിന്റെ മൊഴിയുടെ പൂർണരൂപം പുറത്ത്,https://keralakaumudi.com/news/news.php?id=1520568&u=shine-tom-chacko-open-up-about-complaint,2025-04-21,തിരുവനന്തപുരം: രാസലഹരിക്കേസിൽ നടൻ ഷൈൻ ടോം ചാക്കോ പൊലീസിന് നൽകിയ മൊഴിയുടെ പൂർണരൂപം പുറത്ത്.,2025-04-21
"പരാതിക്ക് പിന്നാലെ സ്പെഷ്യൽ ട്രെയിൻ, നേട്ടം സർക്കാർ ജീവനക്കാർക്ക് മാത്രം: വൈകിട്ട് തുടങ്ങും ആ ദുരിതം",https://keralakaumudi.com/news/news.php?id=1520586&u=train-journey-from-kozhikode-to-the-north-will-begin-after-6-pm,2025-04-21,കോഴിക്കോട്: വെെകിട്ട് ആറു മണികഴിഞ്ഞാൽ തുടങ്ങും കോഴിക്കോട്ടു നിന്ന് വടക്കോട്ടുള്ള ട്രെയിൻ യാത്രാ ദുരിതം.,2025-04-21
