title,url,date,section,datetime
Two Youth Dies In Accident At Thiruvananthapuram 1.10562960,https://www.mathrubhumi.com/news/kerala/two-youth-dies-in-accident-at-thiruvananthapuram-1.10562960,2025-05-05,kerala,2025-05-05
Listin Stephen Reacts On Controversies Nivin Pauli Sandra Thomas 1.10562952,https://www.mathrubhumi.com/movies-music/news/listin-stephen-reacts-on-controversies-nivin-pauli-sandra-thomas-1.10562952,2025-05-05,news,2025-05-05
Man Arrested For Stabbing A Guest At A Wedding In Calicut Kerala 1.10562914,https://www.mathrubhumi.com/crime/news/man-arrested-for-stabbing-a-guest-at-a-wedding-in-calicut-kerala-1.10562914,2025-05-05,news,2025-05-05
Defence Secretary Is Meeting Pm Sources 1.10562955,https://www.mathrubhumi.com/news/india/defence-secretary-is-meeting-pm-sources-1.10562955,2025-05-05,india,2025-05-05
Jiostar Opposes Unified Tv Ott Regulation 1.10562957,https://www.mathrubhumi.com/technology/news/jiostar-opposes-unified-tv-ott-regulation-1.10562957,2025-05-05,news,2025-05-05
Anju Kurian Actor Making Mango Thera Candy Home Recipe 1.10560710,https://www.mathrubhumi.com/food/news/anju-kurian-actor-making-mango-thera-candy-home-recipe-1.10560710,2025-05-04,news,2025-05-04
Muralidharan Attacks Pinarayi Vijayans Udfs Projects 1.10560708,https://www.mathrubhumi.com/news/kerala/muralidharan-attacks-pinarayi-vijayans-udfs-projects-1.10560708,2025-05-04,kerala,2025-05-04
Ukraine Destroyed Russian Jet Seaborne Drone 1.10560707,https://www.mathrubhumi.com/news/world/ukraine-destroyed-russian-jet-seaborne-drone-1.10560707,2025-05-04,world,2025-05-04
Colon Cancer Prevention Nuts Seeds 1.10560673,https://www.mathrubhumi.com/health/news/colon-cancer-prevention-nuts-seeds-1.10560673,2025-05-04,news,2025-05-04
Neet Fake Hall Ticket Case Pathanamthitta 1.10560704,https://www.mathrubhumi.com/careers/news/neet-fake-hall-ticket-case-pathanamthitta-1.10560704,2025-05-04,news,2025-05-04
Australian Election Labour Party Win Anthony Albanese 1.10558612,https://www.mathrubhumi.com/news/world/australian-election-labour-party-win-anthony-albanese-1.10558612,2025-05-03,world,2025-05-03
Woman Gang Raped By Three Kannur Thalassery 1.10558599,https://www.mathrubhumi.com/crime/news/woman-gang-raped-by-three-kannur-thalassery-1.10558599,2025-05-03,news,2025-05-03
Fake Wedding Party Becoming Trend Know Details 1.10558304,https://www.mathrubhumi.com/lifestyle/news/fake-wedding-party-becoming-trend-know-details-1.10558304,2025-05-03,news,2025-05-03
Murukan Kattakada Innagurates Gramodhaya 1.10558445,https://www.mathrubhumi.com/thiruvananthapuram/news/murukan-kattakada-innagurates-gramodhaya-1.10558445,2025-05-03,news,2025-05-03
Neighbor Stabbed Three People In Kozhikode 1.10558496,https://www.mathrubhumi.com/crime/news/neighbor-stabbed-three-people-in-kozhikode-1.10558496,2025-05-03,news,2025-05-03
Linto Joseph Thiruvambadi Mla Inagurates Childrens Summer Vacation Shop 1.10555647,https://www.mathrubhumi.com/lifestyle/news/linto-joseph-thiruvambadi-mla-inagurates-childrens-summer-vacation-shop-1.10555647,2025-05-02,news,2025-05-02
Amur Falcon Completes Non Stop 3 800 Km Long Flight In 93 Hours 1.10555479,https://www.mathrubhumi.com/environment/news/amur-falcon-completes-non-stop-3-800-km-long-flight-in-93-hours-1.10555479,2025-05-02,news,2025-05-02
Youth Died Of Lightning Strike At Varkala 1.10555563,https://www.mathrubhumi.com/news/kerala/youth-died-of-lightning-strike-at-varkala-1.10555563,2025-05-02,kerala,2025-05-02
Kozhikode Medical College Fire Scare 1.10555738,https://www.mathrubhumi.com/news/kerala/kozhikode-medical-college-fire-scare-1.10555738,2025-05-02,kerala,2025-05-02
Dubai International Airport Welcomes 23 4 Million Passengers In Q1 2024 1.10555740,https://www.mathrubhumi.com/travel/news/dubai-international-airport-welcomes-23-4-million-passengers-in-q1-2024-1.10555740,2025-05-02,news,2025-05-02
Suhas Shetty Hacked Death Political Murder 1.10554679,https://www.mathrubhumi.com/crime/news/suhas-shetty-hacked-death-political-murder-1.10554679,2025-05-01,news,2025-05-01
Woman Shares How Chatgpt Saved Her Life When She Was Pregnant Goes Viral 1.10554677,https://www.mathrubhumi.com/lifestyle/news/woman-shares-how-chatgpt-saved-her-life-when-she-was-pregnant-goes-viral-1.10554677,2025-05-01,news,2025-05-01
Robert De Niro Daughter Came Out As Transgender Godfather Star Reacts 1.10554654,https://www.mathrubhumi.com/lifestyle/news/robert-de-niro-daughter-came-out-as-transgender-godfather-star-reacts-1.10554654,2025-05-01,news,2025-05-01
Man Arrested With Mdma Kozhikode City 1.10554657,https://www.mathrubhumi.com/crime/news/man-arrested-with-mdma-kozhikode-city-1.10554657,2025-05-01,news,2025-05-01
Three Year Old Dies In Kannur Road Accident 1.10554650,https://www.mathrubhumi.com/news/kerala/three-year-old-dies-in-kannur-road-accident-1.10554650,2025-05-01,kerala,2025-05-01
Alankode Leelakrishnan Padmaprabha Literary Award Response 1.10552441,https://www.mathrubhumi.com/literature/news/alankode-leelakrishnan-padmaprabha-literary-award-response-1.10552441,2025-04-30,news,2025-04-30
Ib Officer Death Kerala Accused Sukanth Parents 1.10552446,https://www.mathrubhumi.com/crime/news/ib-officer-death-kerala-accused-sukanth-parents-1.10552446,2025-04-30,news,2025-04-30
Kozhikode Teen Assaulted Arrested 1.10552455,https://www.mathrubhumi.com/crime/news/kozhikode-teen-assaulted-arrested-1.10552455,2025-04-30,news,2025-04-30
Boost Nutrition Cooking Tips 1.10552259,https://www.mathrubhumi.com/food/news/boost-nutrition-cooking-tips-1.10552259,2025-04-30,news,2025-04-30
India Airspace Ban Pak Flights Pahalgam Attack 1.10552485,https://www.mathrubhumi.com/news/india/india-airspace-ban-pak-flights-pahalgam-attack-1.10552485,2025-04-30,india,2025-04-30
Sreenath Bhasi Azadi Movie Release On 9 May 1.10549679,https://www.mathrubhumi.com/movies-music/news/sreenath-bhasi-azadi-movie-release-on-9-may-1.10549679,2025-04-29,news,2025-04-29
Perplexity Ai Whatsapp Chatbot 1.10549452,https://www.mathrubhumi.com/technology/news/perplexity-ai-whatsapp-chatbot-1.10549452,2025-04-29,news,2025-04-29
Man Shot Dead By Lover Father Uttar Pradesh 1.10549453,https://www.mathrubhumi.com/crime/news/man-shot-dead-by-lover-father-uttar-pradesh-1.10549453,2025-04-29,news,2025-04-29
Congress Deletes Gayab Post Targeting Pm Modi After Outrage 1.10549448,https://www.mathrubhumi.com/news/india/congress-deletes-gayab-post-targeting-pm-modi-after-outrage-1.10549448,2025-04-29,india,2025-04-29
Mouni Roy Terrifying Experience Stranger Attempting To Enter Her Hotel Room 1.10549442,https://www.mathrubhumi.com/movies-music/news/mouni-roy-terrifying-experience-stranger-attempting-to-enter-her-hotel-room-1.10549442,2025-04-29,news,2025-04-29
Ed Ends Commonwealth Games Ed Case 1.10546473,https://www.mathrubhumi.com/news/india/ed-ends-commonwealth-games-ed-case-1.10546473,2025-04-28,india,2025-04-28
Mohanlal Remembers Shaji N Karun 1.10546498,https://www.mathrubhumi.com/movies-music/news/mohanlal-remembers-shaji-n-karun-1.10546498,2025-04-28,news,2025-04-28
Delhi Zoo Welcomes Asiatic Lion Cubs After 16 Years 1.10546600,https://www.mathrubhumi.com/environment/news/delhi-zoo-welcomes-asiatic-lion-cubs-after-16-years-1.10546600,2025-04-28,news,2025-04-28
Worlds Most Bitter Tasting Thing Ever Discovered By Scientists 1.10546540,https://www.mathrubhumi.com/food/news/worlds-most-bitter-tasting-thing-ever-discovered-by-scientists-1.10546540,2025-04-28,news,2025-04-28
Man Quits Bank Job Started Delivering Milk In Audi Car And Harley Davidson Bike Video 1.10546632,https://www.mathrubhumi.com/lifestyle/news/man-quits-bank-job-started-delivering-milk-in-audi-car-and-harley-davidson-bike-video-1.10546632,2025-04-28,news,2025-04-28
Police Case Against Mother Illegally Giving New Born 1.10543961,https://www.mathrubhumi.com/crime/news/police-case-against-mother-illegally-giving-new-born-1.10543961,2025-04-27,news,2025-04-27
Stalin Reshuffles Cabinet Senthil Balaji Ponmudi Resign 1.10543932,https://www.mathrubhumi.com/news/india/stalin-reshuffles-cabinet-senthil-balaji-ponmudi-resign-1.10543932,2025-04-27,india,2025-04-27
India Withdraws Volleyball Championship 1.10543925,https://www.mathrubhumi.com/sports/news/india-withdraws-volleyball-championship-1.10543925,2025-04-27,news,2025-04-27
Kerala Ganja Seizure Muvattupuzha 1.10543741,https://www.mathrubhumi.com/crime/news/kerala-ganja-seizure-muvattupuzha-1.10543741,2025-04-27,news,2025-04-27
Aamir Khan Girlfriend Gauri Spratt Visit Ex Wife Reena Dutta House Watch Video 1.10543737,https://www.mathrubhumi.com/lifestyle/news/aamir-khan-girlfriend-gauri-spratt-visit-ex-wife-reena-dutta-house-watch-video-1.10543737,2025-04-27,news,2025-04-27
Ganja Seized Thiruvananthapuram Paruthikuzhy Youth Arrested 1.10541092,https://www.mathrubhumi.com/crime/news/ganja-seized-thiruvananthapuram-paruthikuzhy-youth-arrested-1.10541092,2025-04-26,news,2025-04-26
Kerala Feeds Psc Appointments 1.10541164,https://www.mathrubhumi.com/careers/news/kerala-feeds-psc-appointments-1.10541164,2025-04-26,news,2025-04-26
Indian Desserts Snacks Ai Viral Video 1.10541243,https://www.mathrubhumi.com/food/news/indian-desserts-snacks-ai-viral-video-1.10541243,2025-04-26,news,2025-04-26
Modi Distributes 51000 Job Letters 1.10541297,https://www.mathrubhumi.com/news/india/modi-distributes-51000-job-letters-1.10541297,2025-04-26,india,2025-04-26
Virat Kohli Anushka Sharma Moving London Madhuri Dixit Husband Reveals Reason 1.10541086,https://www.mathrubhumi.com/lifestyle/news/virat-kohli-anushka-sharma-moving-london-madhuri-dixit-husband-reveals-reason-1.10541086,2025-04-26,news,2025-04-26
Elephant Turns Violent In Pozhiyur Temple Festival 1.10538539,https://www.mathrubhumi.com/news/kerala/elephant-turns-violent-in-pozhiyur-temple-festival-1.10538539,2025-04-25,kerala,2025-04-25
Technical Issue Thiruvananthapuram Delhi Air India Flight Cancelled 1.10538443,https://www.mathrubhumi.com/news/kerala/technical-issue-thiruvananthapuram-delhi-air-india-flight-cancelled-1.10538443,2025-04-25,kerala,2025-04-25
Pakistani Man Seeks Stay In India For Children S Treatment 1.10538005,https://www.mathrubhumi.com/news/india/pakistani-man-seeks-stay-in-india-for-children-s-treatment-1.10538005,2025-04-25,india,2025-04-25
Us Supports India Pahalgham Terror Attack 1.10537978,https://www.mathrubhumi.com/news/world/us-supports-india-pahalgham-terror-attack-1.10537978,2025-04-25,world,2025-04-25
Top Marks No Internship 1.10537979,https://www.mathrubhumi.com/careers/news/top-marks-no-internship-1.10537979,2025-04-25,news,2025-04-25
Pahalgam Attack All Party Meeting 1.10535538,https://www.mathrubhumi.com/news/india/pahalgam-attack-all-party-meeting-1.10535538,2025-04-24,india,2025-04-24
Alia Bhatts Brother Rahul Compares Her With Pooja Bhatt 1.10535525,https://www.mathrubhumi.com/lifestyle/news/alia-bhatts-brother-rahul-compares-her-with-pooja-bhatt-1.10535525,2025-04-24,news,2025-04-24
Elephant Attack One Died Wayanad 1.10535720,https://www.mathrubhumi.com/news/kerala/elephant-attack-one-died-wayanad-1.10535720,2025-04-24,kerala,2025-04-24
Fake Coding Resume Lands Job Promotion 1.10535587,https://www.mathrubhumi.com/careers/news/fake-coding-resume-lands-job-promotion-1.10535587,2025-04-24,news,2025-04-24
Pakistan Tightens Security At Rawalpindi Army Base And Deploys More Force In Border 1.10535714,https://www.mathrubhumi.com/news/world/pakistan-tightens-security-at-rawalpindi-army-base-and-deploys-more-force-in-border-1.10535714,2025-04-24,world,2025-04-24
Jammu Kashmir Police Takes 1500 Locals In Custody Following Pahalgam Terrorist Attack 1.10532483,https://www.mathrubhumi.com/news/india/jammu-kashmir-police-takes-1500-locals-in-custody-following-pahalgam-terrorist-attack-1.10532483,2025-04-23,india,2025-04-23
Fire And Rescue Team Rescued Man Fell From Thamarassery Churam 1.10532787,https://www.mathrubhumi.com/news/kerala/fire-and-rescue-team-rescued-man-fell-from-thamarassery-churam-1.10532787,2025-04-23,kerala,2025-04-23
Worker Dies Tree Accident 1.10532531,https://www.mathrubhumi.com/news/kerala/worker-dies-tree-accident-1.10532531,2025-04-23,kerala,2025-04-23
Kejriwal Daughter Wedding Paan Counter 1.10532707,https://www.mathrubhumi.com/food/news/kejriwal-daughter-wedding-paan-counter-1.10532707,2025-04-23,news,2025-04-23
Anupam Kher Condemns Pahalgam Terror Attack 1.10532681,https://www.mathrubhumi.com/movies-music/news/anupam-kher-condemns-pahalgam-terror-attack-1.10532681,2025-04-23,news,2025-04-23
Hridayapoorvamm Mohanlal Sathyan Anthikadu Movie Pune Shoot 1.10529629,https://www.mathrubhumi.com/movies-music/news/hridayapoorvamm-mohanlal-sathyan-anthikadu-movie-pune-shoot-1.10529629,2025-04-22,news,2025-04-22
Tv Actor Lalit Manchanda Passes Away 1.10529568,https://www.mathrubhumi.com/movies-music/news/tv-actor-lalit-manchanda-passes-away-1.10529568,2025-04-22,news,2025-04-22
Shabana Azmi Decided To Quit Films After Being Humiliated By Dance Master 1.10529805,https://www.mathrubhumi.com/lifestyle/news/shabana-azmi-decided-to-quit-films-after-being-humiliated-by-dance-master-1.10529805,2025-04-22,news,2025-04-22
Pahalgam Kashmir Tourist Place 1.10529725,https://www.mathrubhumi.com/travel/news/pahalgam-kashmir-tourist-place-1.10529725,2025-04-22,news,2025-04-22
Four Year Old Girl Kidnapped Frm Ksrtc Stand By Woman Found At Woman Also In Custody 1.10529815,https://www.mathrubhumi.com/news/kerala/four-year-old-girl-kidnapped-frm-ksrtc-stand-by-woman-found-at-woman-also-in-custody-1.10529815,2025-04-22,kerala,2025-04-22
Baba Siddiques Son Gets Threat Police Investigation 1.10527083,https://www.mathrubhumi.com/crime/news/baba-siddiques-son-gets-threat-police-investigation-1.10527083,2025-04-21,news,2025-04-21
Pm Modi Gifts Peacock Feathers To Jd Vances Children 1.10526995,https://www.mathrubhumi.com/news/india/pm-modi-gifts-peacock-feathers-to-jd-vances-children-1.10526995,2025-04-21,india,2025-04-21
Auto Driver Killed In Punalur Nellipally Highway Car Auto Accident 1.10526991,https://www.mathrubhumi.com/news/kerala/auto-driver-killed-in-punalur-nellipally-highway-car-auto-accident-1.10526991,2025-04-21,kerala,2025-04-21
Ottakkomban Suresh Gopi Malayalam Movie 1.10526987,https://www.mathrubhumi.com/movies-music/news/ottakkomban-suresh-gopi-malayalam-movie-1.10526987,2025-04-21,news,2025-04-21
India Buldhana Hair Nail Loss 1.10526808,https://www.mathrubhumi.com/health/news/india-buldhana-hair-nail-loss-1.10526808,2025-04-21,news,2025-04-21
